number,value,datetime_start,datetime_complete,duration,params_max_depth,params_max_features,params_min_samples_leaf,params_n_estimators,state
181,2.61071573145684,2026-06-02 18:03:43.938634,2026-06-02 18:03:46.948246,0 days 00:00:03.009612,3,log2,3,408,PRUNED
182,2.3737133833899104,2026-06-02 18:03:46.955588,2026-06-02 18:03:51.560721,0 days 00:00:04.605133,8,log2,2,286,PRUNED
183,2.4061345693648226,2026-06-02 18:03:51.572427,2026-06-02 18:03:54.296977,0 days 00:00:02.724550,6,log2,2,205,PRUNED
184,2.6023031067711413,2026-06-02 18:03:54.304148,2026-06-02 18:03:55.685319,0 days 00:00:01.381171,3,log2,2,157,PRUNED
185,2.5123229916088485,2026-06-02 18:03:55.693317,2026-06-02 18:04:09.944899,0 days 00:00:14.251582,7,log2,3,312,COMPLETE
186,2.5108098615408503,2026-06-02 18:04:09.951902,2026-06-02 18:04:23.717500,0 days 00:00:13.765598,7,log2,4,302,COMPLETE
187,2.3884142195252958,2026-06-02 18:04:23.724500,2026-06-02 18:04:30.139331,0 days 00:00:06.414831,11,log2,5,317,PRUNED
188,2.4390835181543826,2026-06-02 18:04:30.148331,2026-06-02 18:04:33.505514,0 days 00:00:03.357183,5,log2,5,306,PRUNED
189,2.367827051789292,2026-06-02 18:04:33.512514,2026-06-02 18:04:38.387307,0 days 00:00:04.874793,8,log2,4,300,PRUNED
190,2.512297461338355,2026-06-02 18:04:38.394493,2026-06-02 18:04:41.688914,0 days 00:00:03.294421,4,log2,3,370,PRUNED
191,2.436553388591567,2026-06-02 18:04:41.696913,2026-06-02 18:04:52.121111,0 days 00:00:10.424198,28,log2,1,277,PRUNED
192,2.390963612133882,2026-06-02 18:04:52.128111,2026-06-02 18:04:58.862324,0 days 00:00:06.734213,11,log2,4,327,PRUNED
193,2.5114280092312367,2026-06-02 18:04:58.870324,2026-06-02 18:05:14.622543,0 days 00:00:15.752219,7,log2,3,357,COMPLETE
194,2.439584241634265,2026-06-02 18:05:14.630543,2026-06-02 18:05:17.254995,0 days 00:00:02.624452,5,log2,3,240,PRUNED
195,2.3739655435812836,2026-06-02 18:05:17.262381,2026-06-02 18:05:22.957634,0 days 00:00:05.695253,8,log2,3,370,PRUNED
196,2.5117086096941854,2026-06-02 18:05:22.965633,2026-06-02 18:05:36.233127,0 days 00:00:13.267494,7,log2,3,296,COMPLETE
197,2.270319724617621,2026-06-02 18:05:36.240505,2026-06-02 18:05:42.270659,0 days 00:00:06.030154,6,log2,3,417,PRUNED
198,2.3776016464004335,2026-06-02 18:05:42.278658,2026-06-02 18:05:49.629333,0 days 00:00:07.350675,10,log2,3,398,PRUNED
199,2.5112691100439646,2026-06-02 18:05:49.638335,2026-06-02 18:06:01.475956,0 days 00:00:11.837621,7,log2,3,256,COMPLETE
